,q,a
34,4. How will my English course transfer to NMSU?,"During your application process you will need to submit your transcripts showing English courses you have taken at other institutions.
If you took the course at a U.S. accredited institution in a face-to-face format (not online) and the course is determined to be equivalent to ENG111G (the first, basic English course required of all undergraduate students) by NMSU’s Department of English, then yes, the course will transfer to NMSU. Please check with your advisor regarding any additional English courses that may be required for your specific major.
If you took the English course online, NMSU’s Department of English will NOT accept the course as equivalent to either ENG111G or SPCD110 (NMSU’s bridge course that leads to ENG111G).
If your transcript  does not  clearly show that the English course you’re trying to transfer to NMSU was taken face-to-face at another U.S. accredited institution (i.e. was NOT an online course) you may be asked to provide additional evidence clarifying the mode (online or face-to-face). If you cannot provide that evidence, you will be required to complete the English Language Placement Test prior to registering for your first semester’s courses at NMSU.  A hold will be placed on your student account until these questions are resolved.
If you are worried that your English course will not transfer, and that is an important factor in your decision to study at NMSU, we suggest you resolve these questions before arriving in Las Cruces – or definitely before renting an apartment, etc."
35,5. What is the English Language Placement Test (ELPT)?,"The purpose of English Language Placement Test (ELPT) for placement into the correct English course(s) upon your arrival at NMSU.

The ELPT is an important verification test and should be taken seriously.
Non-completion of the test, and/or not showing up for the test, will impact your enrollment at NMSU for the Fall semester

International students that are required to complete the ELPT will receive an informative email, with information about the test date and location, prior to their arrival at NMSU.
Results from the ELPT will be provided to students’ College Dean and the Director of ISSS from placement purposes. The student will receive an email, sent to their NMSU account, with information regarding the required English course(s) and holds placed onto their account."
36,6. What English classes might I be required to take on arrival?,"New international students may be placed into several different course selections based on their results on the ELPT (the English Language Placement Test, find more information here). International students need a high level of proficiency in English to succeed in their studies and to become independent, fully functioning members of the university community. While admission to NMSU is based on TOEFL or IELTS scores, these tests are not designed to reveal a student’s productive use of English in a classroom setting.
Course placements (these courses are taken during the first semester/year at NMSU) following the English Language Placement Test may include:

Courses for undergraduate international students:




SPCD 110, to improve composition and grammar skills necessary for all university-level writing.
ENGL 111M (required for all international undergraduate students), to teach the library, reading and writing skills necessary to do university-level course papers.


Courses for graduate international students:




SPCD 110, as above.
SPCD 470, to introduce graduate students to the special characteristics unique to scholarly and research writing.



In the event that a student’s English language ability presented in the ELPT does not match the skills presented in the TOEFL/IELTS scores submitted, NMSU reserves the right to require additional testing on a case-by-case basis.
It is important to understand that ELPT placement may result in 1-3 semesters of study in addition to a student’s degree plan."
37,1. What is Las Cruces like?,"NMSU Main Campus is located in the sunny city of Las Cruces, where modern innovation meets rich Old West history. A quiet community of around 100,000, Las Cruces has a strong link to its roots as a Mexican, Spanish-speaking village. The historic Mexican-heritage village of Mesilla adjoins the city.
Today, Las Cruces is a fast-growing Sunbelt community especially popular with retirees coming from more expensive, urban, areas with more adverse weather conditions and big-city problems. Residents enjoy 340 days of sunshine, recreational and outdoor adventures, unique culinary experiences, and many other cultural and educational attractions. See local information here."
38,2. What is New Mexico like?,"New Mexico was the 47th state admitted to the U.S., almost 100 years ago. It is one of the largest states by area, but the population remains small and spread out. Although Santa Fe is the state capital, the largest city is Albuquerque, with a population of half a million. The city of El Paso, Texas is much nearer (60 km) and adds urban attractions to the area.
The state of New Mexico is home to some of the most beautiful, unspoiled natural scenery in the U.S., with desert landscapes complemented by soaring peaks. It is one of the Mountain States in the Four Corners region, bordering Arizona, Colorado, and Utah. Outdoor recreational opportunities like biking, hiking, skiing, and camping are numerous. The climate in the state is an attraction, with mostly mild winters and comfortable springs and autumns throughout the state. See New Mexico government information and tourism information."
39,1. What on-campus housing options are there?,"First-year undergraduate students and students under 18 years old are required to live on campus. See more information on https://housing.nmsu.edu/applications/.
On-campus options consist of dormitories and apartments with various options and scales of amenities. There are also many student family housing homes located on the southwest edge of campus, which are a convenient choice for students with family members joining them here. NMSU Housing & Residential Life is responsible for on-campus housing arrangements. Some on-campus housing options require the purchase of meal plans. Utilities (electricity, water, etc.), telephone, and internet access are included in all housing facilities."
40,2. What off-campus housing options are there?,"First-year undergraduate students and students under 18 years old must obtain permission from NMSU Housing & Residential Life to live off-campus.
Off-campus, there are many rental complexes in the immediate campus area, with rents ranging from $300 per month per person and up. Many students rent off-campus apartments, and rent-sharing to save costs is common. If renting an apartment or house, be aware that you may need to arrange your own utilities, telephone service and so on. Usually, apartments require additional payments for utilities – electricity, gas, telephone etc. (while these costs would be included in on-campus housing rates).
There are many off-campus housings located just on the northern edge of campus on University Avenue or very near it (University Avenue runs east-west at the northern edge of campus) and make walking or cycling to campus very convenient. Apartments and apartment-sharing arrangements are usually easy to locate. Apartments can be located through local news sources and online."
41,3. How do I apply for on-campus housing?,"To apply for on-campus housing, a student must be admitted, have their NMSU ID number, and have created their ‘my.NMSU’ account. Through that system, the student will apply for their preferred housing option and pay a deposit. On-campus housing is very popular, so early reservations are highly advised. Please note that the availability of on-campus housing before the official “move-in” date before the start of a semester is limited and provided on a case-by-case basis by the housing department. See more details here."
42,4. Does NMSU have a host family program?,NMSU does not organize or sponsor a host family program involving homestays.
43,1. What support services are there for students?,"NMSU is committed to helping our students succeed, academically, professionally, and personally. To that purpose a full range of services and programs, including orientation, advising, counseling, employment, tutoring, career advising, health services, childcare services for students with young children, and many services are more are offered. For information on student resources, check here.
Additionally, student organizations are an important source of support, especially for international students. International student organizations include the Indian Students Association, the Chinese Students and Scholars Association, the Muslim Students Association, the Korean Students Association, and several others. See a list of chartered student organizations here.
The International Student & Scholar Services office has the mission of supporting the needs of international students on campus. ISSS also sponsors and administers educational and social events on campus and in the greater community. Please contact us with questions at isss@nmsu.edu."
44,1. Where is NMSU?,"New Mexico State University is located in the south-central area of the state of New Mexico in the U.S.A., in the regional city of Las Cruces. It is approximately one hour by car-ride north of the Mexican border city of Ciudad Juarez and on the northern edge of the Chihuahuan Desert. The El Paso International Airport (less than 1 hour away by car-ride) assures easy access nationally and internationally. See NMSU Location on Google Maps and take a virtual tour of the main campus.
NMSU serves a multi-cultural population of students and community members across the state at five campuses (Las Cruces Main Campus, Doña Ana, Grants, Alamogordo, and Carlsbad), a satellite learning center in Albuquerque, cooperative extension offices located in each of New Mexico's 33 counties, and 12 agriculture research and science centers."
